{
  "$schema": "https://solidcn.dev/schema/registry-item.json",
  "name": "select",
  "type": "registry:ui",
  "title": "Select",
  "description": "select component for SolidJS",
  "dependencies": ["@kobalte/core", "lucide-solid"],
  "devDependencies": [],
  "registryDependencies": ["utils"],
  "files": [
    {
      "path": "components/ui/select.tsx",
      "type": "registry:ui",
      "content": "import { Select as KobalteSelect } from \"@kobalte/core/select\";\nimport { Check, ChevronsUpDown } from \"lucide-solid\";\nimport type { Component, ComponentProps } from \"solid-js\";\nimport { splitProps } from \"solid-js\";\nimport { cn } from \"~/lib/utils\";\n\nconst Select = KobalteSelect;\n\nconst SelectTrigger: Component<\n  ComponentProps<typeof KobalteSelect.Trigger> & { placeholder?: string }\n> = (props) => {\n  const [local, rest] = splitProps(props, [\"class\", \"placeholder\"]);\n  return (\n    <KobalteSelect.Trigger\n      class={cn(\n        \"flex h-10 w-full items-center justify-between rounded-md border border-input bg-background px-3 py-2\",\n        \"text-sm ring-offset-background\",\n        \"focus:outline-none focus:ring-2 focus:ring-ring focus:ring-offset-2\",\n        \"disabled:cursor-not-allowed disabled:opacity-50 [&>span]:line-clamp-1\",\n        local.class,\n      )}\n      {...rest}\n    >\n      <KobalteSelect.Value<string>>\n        {(state) => state.selectedOption() ?? local.placeholder ?? \"Select...\"}\n      </KobalteSelect.Value>\n      <KobalteSelect.Icon>\n        <ChevronsUpDown class=\"h-4 w-4 opacity-50\" />\n      </KobalteSelect.Icon>\n    </KobalteSelect.Trigger>\n  );\n};\n\nconst SelectContent: Component<ComponentProps<typeof KobalteSelect.Content>> = (props) => {\n  const [local, rest] = splitProps(props, [\"class\"]);\n  return (\n    <KobalteSelect.Portal>\n      <KobalteSelect.Content\n        class={cn(\n          \"relative z-50 max-h-96 min-w-[8rem] overflow-hidden rounded-md border bg-popover text-popover-foreground shadow-md\",\n          \"data-[expanded]:animate-in data-[closed]:animate-out\",\n          \"data-[closed]:fade-out-0 data-[expanded]:fade-in-0\",\n          \"data-[closed]:zoom-out-95 data-[expanded]:zoom-in-95\",\n          local.class,\n        )}\n        {...rest}\n      >\n        <KobalteSelect.Listbox class=\"p-1\" />\n      </KobalteSelect.Content>\n    </KobalteSelect.Portal>\n  );\n};\n\nconst SelectItem: Component<ComponentProps<typeof KobalteSelect.Item>> = (props) => {\n  const [local, rest] = splitProps(props, [\"class\", \"children\"]);\n  return (\n    <KobalteSelect.Item\n      class={cn(\n        \"relative flex w-full cursor-default select-none items-center rounded-sm py-1.5 pl-8 pr-2 text-sm outline-none\",\n        \"focus:bg-accent focus:text-accent-foreground\",\n        \"data-[disabled]:pointer-events-none data-[disabled]:opacity-50\",\n        local.class,\n      )}\n      {...rest}\n    >\n      <span class=\"absolute left-2 flex h-3.5 w-3.5 items-center justify-center\">\n        <KobalteSelect.ItemIndicator>\n          <Check class=\"h-4 w-4\" />\n        </KobalteSelect.ItemIndicator>\n      </span>\n      <KobalteSelect.ItemLabel>{local.children}</KobalteSelect.ItemLabel>\n    </KobalteSelect.Item>\n  );\n};\n\nconst SelectLabel: Component<ComponentProps<typeof KobalteSelect.Label>> = (props) => {\n  const [local, rest] = splitProps(props, [\"class\"]);\n  return (\n    <KobalteSelect.Label\n      class={cn(\"py-1.5 pl-8 pr-2 text-sm font-semibold\", local.class)}\n      {...rest}\n    />\n  );\n};\n\nconst SelectGroup = KobalteSelect.Section;\n\nexport { Select, SelectTrigger, SelectContent, SelectItem, SelectLabel, SelectGroup };\n"
    }
  ]
}
