{
  "$schema": "https://solidcn.dev/schema/registry-item.json",
  "name": "dropdown-menu",
  "type": "registry:ui",
  "title": "Dropdown Menu",
  "description": "dropdown-menu component for SolidJS",
  "dependencies": ["@kobalte/core", "lucide-solid"],
  "devDependencies": [],
  "registryDependencies": ["utils"],
  "files": [
    {
      "path": "components/ui/dropdown-menu/dropdown-menu.tsx",
      "type": "registry:ui",
      "content": "import { DropdownMenu as KobalteDropdownMenu } from \"@kobalte/core/dropdown-menu\";\nimport { Check, ChevronRight, Circle } from \"lucide-solid\";\nimport type { Component, ComponentProps, JSX } from \"solid-js\";\nimport { splitProps } from \"solid-js\";\nimport { cn } from \"~/lib/utils\";\n\nconst DropdownMenu = KobalteDropdownMenu;\nconst DropdownMenuTrigger = KobalteDropdownMenu.Trigger;\nconst DropdownMenuPortal = KobalteDropdownMenu.Portal;\nconst DropdownMenuSub = KobalteDropdownMenu.Sub;\nconst DropdownMenuRadioGroup = KobalteDropdownMenu.RadioGroup;\n\nconst DropdownMenuSubTrigger: Component<\n  ComponentProps<typeof KobalteDropdownMenu.SubTrigger> & { inset?: boolean }\n> = (props) => {\n  const [local, rest] = splitProps(props, [\"class\", \"inset\", \"children\"]);\n  return (\n    <KobalteDropdownMenu.SubTrigger\n      class={cn(\n        \"flex cursor-default select-none items-center rounded-sm px-2 py-1.5 text-sm outline-none\",\n        \"focus:bg-accent data-[expanded]:bg-accent\",\n        local.inset && \"pl-8\",\n        local.class,\n      )}\n      {...rest}\n    >\n      {local.children}\n      <ChevronRight class=\"ml-auto h-4 w-4\" />\n    </KobalteDropdownMenu.SubTrigger>\n  );\n};\n\nconst DropdownMenuSubContent: Component<ComponentProps<typeof KobalteDropdownMenu.SubContent>> = (\n  props,\n) => {\n  const [local, rest] = splitProps(props, [\"class\"]);\n  return (\n    <KobalteDropdownMenu.SubContent\n      class={cn(\n        \"z-50 min-w-[8rem] overflow-hidden rounded-md border bg-popover p-1 text-popover-foreground shadow-lg\",\n        \"data-[expanded]:animate-in data-[closed]:animate-out\",\n        \"data-[closed]:fade-out-0 data-[expanded]:fade-in-0\",\n        \"data-[closed]:zoom-out-95 data-[expanded]:zoom-in-95\",\n        local.class,\n      )}\n      {...rest}\n    />\n  );\n};\n\nconst DropdownMenuContent: Component<ComponentProps<typeof KobalteDropdownMenu.Content>> = (\n  props,\n) => {\n  const [local, rest] = splitProps(props, [\"class\"]);\n  return (\n    <KobalteDropdownMenu.Portal>\n      <KobalteDropdownMenu.Content\n        class={cn(\n          \"z-50 min-w-[8rem] overflow-hidden rounded-md border bg-popover p-1 text-popover-foreground shadow-md\",\n          \"data-[expanded]:animate-in data-[closed]:animate-out\",\n          \"data-[closed]:fade-out-0 data-[expanded]:fade-in-0\",\n          \"data-[closed]:zoom-out-95 data-[expanded]:zoom-in-95\",\n          local.class,\n        )}\n        {...rest}\n      />\n    </KobalteDropdownMenu.Portal>\n  );\n};\n\nconst DropdownMenuItem: Component<\n  ComponentProps<typeof KobalteDropdownMenu.Item> & { inset?: boolean }\n> = (props) => {\n  const [local, rest] = splitProps(props, [\"class\", \"inset\"]);\n  return (\n    <KobalteDropdownMenu.Item\n      class={cn(\n        \"relative flex cursor-default select-none items-center rounded-sm px-2 py-1.5 text-sm outline-none transition-colors\",\n        \"focus:bg-accent focus:text-accent-foreground\",\n        \"data-[disabled]:pointer-events-none data-[disabled]:opacity-50\",\n        local.inset && \"pl-8\",\n        local.class,\n      )}\n      {...rest}\n    />\n  );\n};\n\nconst DropdownMenuCheckboxItem: Component<\n  ComponentProps<typeof KobalteDropdownMenu.CheckboxItem>\n> = (props) => {\n  const [local, rest] = splitProps(props, [\"class\", \"children\"]);\n  return (\n    <KobalteDropdownMenu.CheckboxItem\n      class={cn(\n        \"relative flex cursor-default select-none items-center rounded-sm py-1.5 pl-8 pr-2 text-sm outline-none transition-colors\",\n        \"focus:bg-accent focus:text-accent-foreground\",\n        \"data-[disabled]:pointer-events-none data-[disabled]:opacity-50\",\n        local.class,\n      )}\n      {...rest}\n    >\n      <span class=\"absolute left-2 flex h-3.5 w-3.5 items-center justify-center\">\n        <KobalteDropdownMenu.ItemIndicator>\n          <Check class=\"h-4 w-4\" />\n        </KobalteDropdownMenu.ItemIndicator>\n      </span>\n      {local.children}\n    </KobalteDropdownMenu.CheckboxItem>\n  );\n};\n\nconst DropdownMenuRadioItem: Component<ComponentProps<typeof KobalteDropdownMenu.RadioItem>> = (\n  props,\n) => {\n  const [local, rest] = splitProps(props, [\"class\", \"children\"]);\n  return (\n    <KobalteDropdownMenu.RadioItem\n      class={cn(\n        \"relative flex cursor-default select-none items-center rounded-sm py-1.5 pl-8 pr-2 text-sm outline-none transition-colors\",\n        \"focus:bg-accent focus:text-accent-foreground\",\n        \"data-[disabled]:pointer-events-none data-[disabled]:opacity-50\",\n        local.class,\n      )}\n      {...rest}\n    >\n      <span class=\"absolute left-2 flex h-3.5 w-3.5 items-center justify-center\">\n        <KobalteDropdownMenu.ItemIndicator>\n          <Circle class=\"h-2 w-2 fill-current\" />\n        </KobalteDropdownMenu.ItemIndicator>\n      </span>\n      {local.children}\n    </KobalteDropdownMenu.RadioItem>\n  );\n};\n\nconst DropdownMenuLabel: Component<JSX.HTMLAttributes<HTMLDivElement> & { inset?: boolean }> = (\n  props,\n) => {\n  const [local, rest] = splitProps(props, [\"class\", \"inset\"]);\n  return (\n    <div\n      class={cn(\"px-2 py-1.5 text-sm font-semibold\", local.inset && \"pl-8\", local.class)}\n      {...rest}\n    />\n  );\n};\n\nconst DropdownMenuSeparator: Component<ComponentProps<typeof KobalteDropdownMenu.Separator>> = (\n  props,\n) => {\n  const [local, rest] = splitProps(props, [\"class\"]);\n  return (\n    <KobalteDropdownMenu.Separator class={cn(\"-mx-1 my-1 h-px bg-muted\", local.class)} {...rest} />\n  );\n};\n\nconst DropdownMenuShortcut: Component<JSX.HTMLAttributes<HTMLSpanElement>> = (props) => {\n  const [local, rest] = splitProps(props, [\"class\"]);\n  return <span class={cn(\"ml-auto text-xs tracking-widest opacity-60\", local.class)} {...rest} />;\n};\n\nexport {\n  DropdownMenu,\n  DropdownMenuTrigger,\n  DropdownMenuPortal,\n  DropdownMenuContent,\n  DropdownMenuItem,\n  DropdownMenuCheckboxItem,\n  DropdownMenuRadioGroup,\n  DropdownMenuRadioItem,\n  DropdownMenuLabel,\n  DropdownMenuSeparator,\n  DropdownMenuShortcut,\n  DropdownMenuSub,\n  DropdownMenuSubTrigger,\n  DropdownMenuSubContent,\n};\n"
    },
    {
      "path": "components/ui/dropdown-menu/index.ts",
      "type": "registry:ui",
      "content": "export {\n  DropdownMenu,\n  DropdownMenuTrigger,\n  DropdownMenuPortal,\n  DropdownMenuContent,\n  DropdownMenuItem,\n  DropdownMenuCheckboxItem,\n  DropdownMenuRadioGroup,\n  DropdownMenuRadioItem,\n  DropdownMenuLabel,\n  DropdownMenuSeparator,\n  DropdownMenuShortcut,\n  DropdownMenuSub,\n  DropdownMenuSubTrigger,\n  DropdownMenuSubContent,\n} from \"./dropdown-menu\";\n"
    }
  ]
}
