{
  "$schema": "https://solidcn.dev/schema/registry-item.json",
  "name": "combobox",
  "type": "registry:ui",
  "title": "Combobox",
  "description": "combobox component for SolidJS",
  "dependencies": ["@kobalte/core", "lucide-solid"],
  "devDependencies": [],
  "registryDependencies": ["utils"],
  "files": [
    {
      "path": "components/ui/combobox/combobox.tsx",
      "type": "registry:ui",
      "content": "import { Combobox as KobalteCombobox } from \"@kobalte/core/combobox\";\nimport { Check, ChevronsUpDown } from \"lucide-solid\";\nimport type { Component, ComponentProps } from \"solid-js\";\nimport { splitProps } from \"solid-js\";\nimport { cn } from \"~/lib/utils\";\n\nconst Combobox = KobalteCombobox;\n\nconst ComboboxTrigger: Component<{ class?: string }> = (props) => {\n  return (\n    <KobalteCombobox.Control class={cn(\"flex items-center\", props.class)}>\n      <KobalteCombobox.Input\n        class={cn(\n          \"flex h-10 w-full rounded-md border border-input bg-background px-3 py-2\",\n          \"text-sm ring-offset-background placeholder:text-muted-foreground\",\n          \"focus-visible:outline-none focus-visible:ring-2 focus-visible:ring-ring focus-visible:ring-offset-2\",\n          \"disabled:cursor-not-allowed disabled:opacity-50\",\n        )}\n      />\n      <KobalteCombobox.Trigger class=\"-ml-10 flex h-10 w-10 items-center justify-center\">\n        <ChevronsUpDown class=\"h-4 w-4 opacity-50\" />\n      </KobalteCombobox.Trigger>\n    </KobalteCombobox.Control>\n  );\n};\n\nconst ComboboxContent: Component<ComponentProps<typeof KobalteCombobox.Content>> = (props) => {\n  const [local, rest] = splitProps(props, [\"class\"]);\n  return (\n    <KobalteCombobox.Portal>\n      <KobalteCombobox.Content\n        class={cn(\n          \"relative z-50 max-h-96 min-w-[8rem] overflow-hidden rounded-md border bg-popover text-popover-foreground shadow-md\",\n          \"data-[expanded]:animate-in data-[closed]:animate-out\",\n          \"data-[closed]:fade-out-0 data-[expanded]:fade-in-0\",\n          \"data-[closed]:zoom-out-95 data-[expanded]:zoom-in-95\",\n          local.class,\n        )}\n        {...rest}\n      >\n        <KobalteCombobox.Listbox class=\"p-1\" />\n      </KobalteCombobox.Content>\n    </KobalteCombobox.Portal>\n  );\n};\n\nconst ComboboxItem: Component<ComponentProps<typeof KobalteCombobox.Item>> = (props) => {\n  const [local, rest] = splitProps(props, [\"class\", \"children\"]);\n  return (\n    <KobalteCombobox.Item\n      class={cn(\n        \"relative flex w-full cursor-default select-none items-center rounded-sm py-1.5 pl-8 pr-2 text-sm outline-none\",\n        \"data-[highlighted]:bg-accent data-[highlighted]:text-accent-foreground\",\n        \"data-[disabled]:pointer-events-none data-[disabled]:opacity-50\",\n        local.class,\n      )}\n      {...rest}\n    >\n      <span class=\"absolute left-2 flex h-3.5 w-3.5 items-center justify-center\">\n        <KobalteCombobox.ItemIndicator>\n          <Check class=\"h-4 w-4\" />\n        </KobalteCombobox.ItemIndicator>\n      </span>\n      <KobalteCombobox.ItemLabel>{local.children}</KobalteCombobox.ItemLabel>\n    </KobalteCombobox.Item>\n  );\n};\n\nexport { Combobox, ComboboxTrigger, ComboboxContent, ComboboxItem };\n"
    },
    {
      "path": "components/ui/combobox/index.ts",
      "type": "registry:ui",
      "content": "export { Combobox, ComboboxTrigger, ComboboxContent, ComboboxItem } from \"./combobox\";\n"
    }
  ]
}
