{
  "$schema": "https://solidcn.dev/schema/registry-item.json",
  "name": "date-picker",
  "type": "registry:ui",
  "title": "Date Picker",
  "description": "date-picker component for SolidJS",
  "dependencies": ["lucide-solid"],
  "devDependencies": [],
  "registryDependencies": ["button", "calendar", "popover", "utils"],
  "files": [
    {
      "path": "components/ui/date-picker/date-picker.tsx",
      "type": "registry:ui",
      "content": "import { CalendarIcon } from \"lucide-solid\";\nimport type { Component } from \"solid-js\";\nimport { createSignal, splitProps } from \"solid-js\";\nimport { cn } from \"~/lib/utils\";\nimport { Button } from \"../button/button\";\nimport { Calendar } from \"../calendar/calendar\";\nimport { Popover, PopoverContent, PopoverTrigger } from \"../popover/popover\";\n\nexport type DatePickerProps = {\n  class?: string;\n  selected?: Date;\n  onSelect?: (date: Date) => void;\n  placeholder?: string;\n  disabled?: boolean;\n  format?: (date: Date) => string;\n};\n\nconst defaultFormat = (date: Date) =>\n  date.toLocaleDateString(\"en-US\", { year: \"numeric\", month: \"long\", day: \"numeric\" });\n\nexport const DatePicker: Component<DatePickerProps> = (props) => {\n  const [local] = splitProps(props, [\n    \"class\",\n    \"selected\",\n    \"onSelect\",\n    \"placeholder\",\n    \"disabled\",\n    \"format\",\n  ]);\n\n  const [open, setOpen] = createSignal(false);\n  const fmt = () => local.format ?? defaultFormat;\n\n  return (\n    <Popover open={open()} onOpenChange={setOpen}>\n      <PopoverTrigger\n        as={Button}\n        variant=\"outline\"\n        class={cn(\n          \"w-[280px] justify-start text-left font-normal\",\n          !local.selected && \"text-muted-foreground\",\n          local.class,\n        )}\n        disabled={local.disabled}\n      >\n        <CalendarIcon class=\"mr-2 h-4 w-4\" />\n        {local.selected ? fmt()(local.selected) : (local.placeholder ?? \"Pick a date\")}\n      </PopoverTrigger>\n      <PopoverContent showClose={false} class=\"w-auto p-0\">\n        <Calendar\n          {...(local.selected !== undefined ? { selected: local.selected } : {})}\n          onSelect={(date) => {\n            local.onSelect?.(date);\n            setOpen(false);\n          }}\n        />\n      </PopoverContent>\n    </Popover>\n  );\n};\n"
    },
    {
      "path": "components/ui/date-picker/index.ts",
      "type": "registry:ui",
      "content": "export { DatePicker } from \"./date-picker\";\nexport type { DatePickerProps } from \"./date-picker\";\n"
    }
  ]
}
