{
  "$schema": "https://solidcn.dev/schema/registry-item.json",
  "name": "menubar",
  "type": "registry:ui",
  "title": "Menubar",
  "description": "menubar component for SolidJS",
  "dependencies": ["@kobalte/core", "lucide-solid"],
  "devDependencies": [],
  "registryDependencies": ["utils"],
  "files": [
    {
      "path": "components/ui/menubar/index.ts",
      "type": "registry:ui",
      "content": "export {\n  Menubar,\n  MenubarMenu,\n  MenubarTrigger,\n  MenubarContent,\n  MenubarItem,\n  MenubarSub,\n  MenubarSubTrigger,\n  MenubarSubContent,\n  MenubarCheckboxItem,\n  MenubarRadioGroup,\n  MenubarRadioItem,\n  MenubarLabel,\n  MenubarSeparator,\n  MenubarShortcut,\n} from \"./menubar\";\n"
    },
    {
      "path": "components/ui/menubar/menubar.tsx",
      "type": "registry:ui",
      "content": "import { Menubar as KobalteMenubar } from \"@kobalte/core/menubar\";\nimport { Check, ChevronRight, Circle } from \"lucide-solid\";\nimport type { Component, ComponentProps, JSX } from \"solid-js\";\nimport { splitProps } from \"solid-js\";\nimport { cn } from \"~/lib/utils\";\n\nconst Menubar: Component<ComponentProps<typeof KobalteMenubar> & { class?: string }> = (props) => {\n  const [local, rest] = splitProps(props, [\"class\"]);\n  return (\n    <KobalteMenubar\n      class={cn(\n        \"flex h-10 items-center space-x-1 rounded-md border bg-background p-1\",\n        local.class,\n      )}\n      {...rest}\n    />\n  );\n};\n\nconst MenubarMenu = KobalteMenubar.Menu;\n\nconst MenubarTrigger: Component<ComponentProps<typeof KobalteMenubar.Trigger>> = (props) => {\n  const [local, rest] = splitProps(props, [\"class\"]);\n  return (\n    <KobalteMenubar.Trigger\n      class={cn(\n        \"flex cursor-default select-none items-center rounded-sm px-3 py-1.5 text-sm font-medium outline-none\",\n        \"focus:bg-accent focus:text-accent-foreground\",\n        \"data-[expanded]:bg-accent data-[expanded]:text-accent-foreground\",\n        local.class,\n      )}\n      {...rest}\n    />\n  );\n};\n\nconst MenubarContent: Component<ComponentProps<typeof KobalteMenubar.Content>> = (props) => {\n  const [local, rest] = splitProps(props, [\"class\"]);\n  return (\n    <KobalteMenubar.Portal>\n      <KobalteMenubar.Content\n        class={cn(\n          \"z-50 min-w-[12rem] overflow-hidden rounded-md border bg-popover p-1 text-popover-foreground shadow-md\",\n          \"data-[expanded]:animate-in data-[closed]:animate-out\",\n          \"data-[closed]:fade-out-0 data-[expanded]:fade-in-0\",\n          \"data-[closed]:zoom-out-95 data-[expanded]:zoom-in-95\",\n          local.class,\n        )}\n        {...rest}\n      />\n    </KobalteMenubar.Portal>\n  );\n};\n\nconst MenubarItem: Component<ComponentProps<typeof KobalteMenubar.Item> & { inset?: boolean }> = (\n  props,\n) => {\n  const [local, rest] = splitProps(props, [\"class\", \"inset\"]);\n  return (\n    <KobalteMenubar.Item\n      class={cn(\n        \"relative flex cursor-default select-none items-center rounded-sm px-2 py-1.5 text-sm outline-none\",\n        \"focus:bg-accent focus:text-accent-foreground\",\n        \"data-[disabled]:pointer-events-none data-[disabled]:opacity-50\",\n        local.inset && \"pl-8\",\n        local.class,\n      )}\n      {...rest}\n    />\n  );\n};\n\nconst MenubarSub = KobalteMenubar.Sub;\n\nconst MenubarSubTrigger: Component<\n  ComponentProps<typeof KobalteMenubar.SubTrigger> & { inset?: boolean }\n> = (props) => {\n  const [local, rest] = splitProps(props, [\"class\", \"inset\", \"children\"]);\n  return (\n    <KobalteMenubar.SubTrigger\n      class={cn(\n        \"flex cursor-default select-none items-center rounded-sm px-2 py-1.5 text-sm outline-none\",\n        \"focus:bg-accent data-[expanded]:bg-accent\",\n        local.inset && \"pl-8\",\n        local.class,\n      )}\n      {...rest}\n    >\n      {local.children}\n      <ChevronRight class=\"ml-auto h-4 w-4\" />\n    </KobalteMenubar.SubTrigger>\n  );\n};\n\nconst MenubarSubContent: Component<ComponentProps<typeof KobalteMenubar.SubContent>> = (props) => {\n  const [local, rest] = splitProps(props, [\"class\"]);\n  return (\n    <KobalteMenubar.SubContent\n      class={cn(\n        \"z-50 min-w-[8rem] overflow-hidden rounded-md border bg-popover p-1 text-popover-foreground shadow-lg\",\n        \"data-[expanded]:animate-in data-[closed]:animate-out data-[closed]:fade-out-0 data-[expanded]:fade-in-0\",\n        local.class,\n      )}\n      {...rest}\n    />\n  );\n};\n\nconst MenubarCheckboxItem: Component<ComponentProps<typeof KobalteMenubar.CheckboxItem>> = (\n  props,\n) => {\n  const [local, rest] = splitProps(props, [\"class\", \"children\"]);\n  return (\n    <KobalteMenubar.CheckboxItem\n      class={cn(\n        \"relative flex cursor-default select-none items-center rounded-sm py-1.5 pl-8 pr-2 text-sm outline-none\",\n        \"focus:bg-accent focus:text-accent-foreground\",\n        \"data-[disabled]:pointer-events-none data-[disabled]:opacity-50\",\n        local.class,\n      )}\n      {...rest}\n    >\n      <span class=\"absolute left-2 flex h-3.5 w-3.5 items-center justify-center\">\n        <KobalteMenubar.ItemIndicator>\n          <Check class=\"h-4 w-4\" />\n        </KobalteMenubar.ItemIndicator>\n      </span>\n      {local.children}\n    </KobalteMenubar.CheckboxItem>\n  );\n};\n\nconst MenubarRadioGroup = KobalteMenubar.RadioGroup;\n\nconst MenubarRadioItem: Component<ComponentProps<typeof KobalteMenubar.RadioItem>> = (props) => {\n  const [local, rest] = splitProps(props, [\"class\", \"children\"]);\n  return (\n    <KobalteMenubar.RadioItem\n      class={cn(\n        \"relative flex cursor-default select-none items-center rounded-sm py-1.5 pl-8 pr-2 text-sm outline-none\",\n        \"focus:bg-accent focus:text-accent-foreground\",\n        \"data-[disabled]:pointer-events-none data-[disabled]:opacity-50\",\n        local.class,\n      )}\n      {...rest}\n    >\n      <span class=\"absolute left-2 flex h-3.5 w-3.5 items-center justify-center\">\n        <KobalteMenubar.ItemIndicator>\n          <Circle class=\"h-2 w-2 fill-current\" />\n        </KobalteMenubar.ItemIndicator>\n      </span>\n      {local.children}\n    </KobalteMenubar.RadioItem>\n  );\n};\n\nconst MenubarLabel: Component<JSX.HTMLAttributes<HTMLDivElement> & { inset?: boolean }> = (\n  props,\n) => {\n  const [local, rest] = splitProps(props, [\"class\", \"inset\"]);\n  return (\n    <div\n      class={cn(\"px-2 py-1.5 text-sm font-semibold\", local.inset && \"pl-8\", local.class)}\n      {...rest}\n    />\n  );\n};\n\nconst MenubarSeparator: Component<ComponentProps<typeof KobalteMenubar.Separator>> = (props) => {\n  const [local, rest] = splitProps(props, [\"class\"]);\n  return <KobalteMenubar.Separator class={cn(\"-mx-1 my-1 h-px bg-muted\", local.class)} {...rest} />;\n};\n\nconst MenubarShortcut: Component<JSX.HTMLAttributes<HTMLSpanElement>> = (props) => {\n  const [local, rest] = splitProps(props, [\"class\"]);\n  return (\n    <span\n      class={cn(\"ml-auto text-xs tracking-widest text-muted-foreground\", local.class)}\n      {...rest}\n    />\n  );\n};\n\nexport {\n  Menubar,\n  MenubarMenu,\n  MenubarTrigger,\n  MenubarContent,\n  MenubarItem,\n  MenubarSub,\n  MenubarSubTrigger,\n  MenubarSubContent,\n  MenubarCheckboxItem,\n  MenubarRadioGroup,\n  MenubarRadioItem,\n  MenubarLabel,\n  MenubarSeparator,\n  MenubarShortcut,\n};\n"
    }
  ]
}
