{
  "$schema": "https://solidcn.dev/schema/registry-item.json",
  "name": "breadcrumb",
  "type": "registry:ui",
  "title": "Breadcrumb",
  "description": "breadcrumb component for SolidJS",
  "dependencies": ["lucide-solid"],
  "devDependencies": [],
  "registryDependencies": ["utils"],
  "files": [
    {
      "path": "components/ui/breadcrumb.tsx",
      "type": "registry:ui",
      "content": "import { ChevronRight, MoreHorizontal } from \"lucide-solid\";\nimport type { Component, JSX } from \"solid-js\";\nimport { splitProps } from \"solid-js\";\nimport { cn } from \"~/lib/utils\";\n\nconst Breadcrumb: Component<JSX.HTMLAttributes<HTMLElement> & { separator?: JSX.Element }> = (\n  props,\n) => {\n  const [local, rest] = splitProps(props, [\"class\", \"separator\"]);\n  return <nav aria-label=\"breadcrumb\" class={local.class} {...rest} />;\n};\n\nconst BreadcrumbList: Component<JSX.HTMLAttributes<HTMLOListElement>> = (props) => {\n  const [local, rest] = splitProps(props, [\"class\"]);\n  return (\n    <ol\n      class={cn(\n        \"flex flex-wrap items-center gap-1.5 break-words text-sm text-muted-foreground sm:gap-2.5\",\n        local.class,\n      )}\n      {...rest}\n    />\n  );\n};\n\nconst BreadcrumbItem: Component<JSX.HTMLAttributes<HTMLLIElement>> = (props) => {\n  const [local, rest] = splitProps(props, [\"class\"]);\n  return <li class={cn(\"inline-flex items-center gap-1.5\", local.class)} {...rest} />;\n};\n\nconst BreadcrumbLink: Component<\n  JSX.AnchorHTMLAttributes<HTMLAnchorElement> & { asChild?: boolean }\n> = (props) => {\n  const [local, rest] = splitProps(props, [\"class\"]);\n  return <a class={cn(\"transition-colors hover:text-foreground\", local.class)} {...rest} />;\n};\n\nconst BreadcrumbPage: Component<JSX.HTMLAttributes<HTMLSpanElement>> = (props) => {\n  const [local, rest] = splitProps(props, [\"class\"]);\n  return (\n    <span\n      aria-disabled=\"true\"\n      aria-current=\"page\"\n      class={cn(\"font-normal text-foreground\", local.class)}\n      {...rest}\n    />\n  );\n};\n\nconst BreadcrumbSeparator: Component<JSX.HTMLAttributes<HTMLLIElement>> = (props) => {\n  const [local, rest] = splitProps(props, [\"class\", \"children\"]);\n  return (\n    <li\n      role=\"presentation\"\n      aria-hidden=\"true\"\n      class={cn(\"[&>svg]:size-3.5\", local.class)}\n      {...rest}\n    >\n      {local.children ?? <ChevronRight />}\n    </li>\n  );\n};\n\nconst BreadcrumbEllipsis: Component<JSX.HTMLAttributes<HTMLSpanElement>> = (props) => {\n  const [local, rest] = splitProps(props, [\"class\"]);\n  return (\n    <span\n      role=\"presentation\"\n      aria-hidden=\"true\"\n      class={cn(\"flex h-9 w-9 items-center justify-center\", local.class)}\n      {...rest}\n    >\n      <MoreHorizontal class=\"h-4 w-4\" />\n      <span class=\"sr-only\">More</span>\n    </span>\n  );\n};\n\nexport {\n  Breadcrumb,\n  BreadcrumbList,\n  BreadcrumbItem,\n  BreadcrumbLink,\n  BreadcrumbPage,\n  BreadcrumbSeparator,\n  BreadcrumbEllipsis,\n};\n"
    }
  ]
}
