{
  "$schema": "https://solidcn.dev/schema/registry-item.json",
  "name": "badge",
  "type": "registry:ui",
  "title": "Badge",
  "description": "badge component for SolidJS",
  "dependencies": ["class-variance-authority"],
  "devDependencies": [],
  "registryDependencies": ["utils"],
  "files": [
    {
      "path": "components/ui/badge/badge.tsx",
      "type": "registry:ui",
      "content": "import type { Component, JSX } from \"solid-js\";\nimport { splitProps } from \"solid-js\";\nimport { cva, type VariantProps } from \"class-variance-authority\";\nimport { cn } from \"~/lib/utils\";\n\nexport const badgeVariants = cva(\n  \"inline-flex items-center rounded-full border px-2.5 py-0.5 text-xs font-semibold transition-colors focus:outline-none focus:ring-2 focus:ring-ring focus:ring-offset-2\",\n  {\n    variants: {\n      variant: {\n        default: \"border-transparent bg-primary text-primary-foreground hover:bg-primary/80\",\n        secondary: \"border-transparent bg-secondary text-secondary-foreground hover:bg-secondary/80\",\n        destructive:\n          \"border-transparent bg-destructive text-destructive-foreground hover:bg-destructive/80\",\n        outline: \"text-foreground\",\n      },\n    },\n    defaultVariants: {\n      variant: \"default\",\n    },\n  },\n);\n\nexport type BadgeProps = JSX.HTMLAttributes<HTMLDivElement> & VariantProps<typeof badgeVariants>;\n\nexport const Badge: Component<BadgeProps> = (props) => {\n  const [local, variants, rest] = splitProps(props, [\"class\"], [\"variant\"]);\n\n  return <div class={cn(badgeVariants(variants), local.class)} {...rest} />;\n};\n"
    },
    {
      "path": "components/ui/badge/index.ts",
      "type": "registry:ui",
      "content": "export { Badge, badgeVariants } from \"./badge\";\nexport type { BadgeProps } from \"./badge\";\n"
    }
  ]
}
