{
  "$schema": "https://solidcn.dev/schema/registry-item.json",
  "name": "button",
  "type": "registry:ui",
  "title": "Button",
  "description": "button component for SolidJS",
  "dependencies": ["class-variance-authority"],
  "devDependencies": [],
  "registryDependencies": ["utils"],
  "files": [
    {
      "path": "components/ui/button/button.tsx",
      "type": "registry:ui",
      "content": "import type { Component, JSX } from \"solid-js\";\nimport { splitProps } from \"solid-js\";\nimport { cva, type VariantProps } from \"class-variance-authority\";\nimport { cn } from \"~/lib/utils\";\n\nexport const buttonVariants = cva(\n  [\n    \"inline-flex items-center justify-center gap-2 whitespace-nowrap rounded-md text-sm font-medium\",\n    \"ring-offset-background transition-colors\",\n    \"focus-visible:outline-none focus-visible:ring-2 focus-visible:ring-ring focus-visible:ring-offset-2\",\n    \"disabled:pointer-events-none disabled:opacity-50\",\n    \"[&_svg]:pointer-events-none [&_svg]:size-4 [&_svg]:shrink-0\",\n  ],\n  {\n    variants: {\n      variant: {\n        default: \"bg-primary text-primary-foreground hover:bg-primary/90\",\n        destructive: \"bg-destructive text-destructive-foreground hover:bg-destructive/90\",\n        outline: \"border border-input bg-background hover:bg-accent hover:text-accent-foreground\",\n        secondary: \"bg-secondary text-secondary-foreground hover:bg-secondary/80\",\n        ghost: \"hover:bg-accent hover:text-accent-foreground\",\n        link: \"text-primary underline-offset-4 hover:underline\",\n      },\n      size: {\n        default: \"h-10 px-4 py-2\",\n        sm: \"h-9 rounded-md px-3\",\n        lg: \"h-11 rounded-md px-8\",\n        icon: \"h-10 w-10\",\n      },\n    },\n    defaultVariants: {\n      variant: \"default\",\n      size: \"default\",\n    },\n  },\n);\n\nexport type ButtonProps = JSX.ButtonHTMLAttributes<HTMLButtonElement> &\n  VariantProps<typeof buttonVariants> & {\n    asChild?: boolean;\n  };\n\nexport const Button: Component<ButtonProps> = (props) => {\n  const [local, variants, rest] = splitProps(props, [\"class\"], [\"variant\", \"size\"]);\n\n  return <button class={cn(buttonVariants(variants), local.class)} {...rest} />;\n};\n"
    },
    {
      "path": "components/ui/button/index.ts",
      "type": "registry:ui",
      "content": "export { Button, buttonVariants } from \"./button\";\nexport type { ButtonProps } from \"./button\";\n"
    }
  ]
}
