{
  "$schema": "https://solidcn.dev/schema/registry-item.json",
  "name": "table",
  "type": "registry:ui",
  "title": "Table",
  "description": "table component for SolidJS",
  "dependencies": [],
  "devDependencies": [],
  "registryDependencies": ["utils"],
  "files": [
    {
      "path": "components/ui/table.tsx",
      "type": "registry:ui",
      "content": "import type { Component, JSX } from \"solid-js\";\nimport { splitProps } from \"solid-js\";\nimport { cn } from \"~/lib/utils\";\n\nconst Table: Component<JSX.HTMLAttributes<HTMLTableElement>> = (props) => {\n  const [local, rest] = splitProps(props, [\"class\"]);\n  return (\n    <div class=\"relative w-full overflow-auto\">\n      <table class={cn(\"w-full caption-bottom text-sm\", local.class)} {...rest} />\n    </div>\n  );\n};\n\nconst TableHeader: Component<JSX.HTMLAttributes<HTMLTableSectionElement>> = (props) => {\n  const [local, rest] = splitProps(props, [\"class\"]);\n  return <thead class={cn(\"[&_tr]:border-b\", local.class)} {...rest} />;\n};\n\nconst TableBody: Component<JSX.HTMLAttributes<HTMLTableSectionElement>> = (props) => {\n  const [local, rest] = splitProps(props, [\"class\"]);\n  return <tbody class={cn(\"[&_tr:last-child]:border-0\", local.class)} {...rest} />;\n};\n\nconst TableFooter: Component<JSX.HTMLAttributes<HTMLTableSectionElement>> = (props) => {\n  const [local, rest] = splitProps(props, [\"class\"]);\n  return (\n    <tfoot\n      class={cn(\"border-t bg-muted/50 font-medium [&>tr]:last:border-b-0\", local.class)}\n      {...rest}\n    />\n  );\n};\n\nconst TableRow: Component<JSX.HTMLAttributes<HTMLTableRowElement>> = (props) => {\n  const [local, rest] = splitProps(props, [\"class\"]);\n  return (\n    <tr\n      class={cn(\n        \"border-b transition-colors hover:bg-muted/50 data-[state=selected]:bg-muted\",\n        local.class,\n      )}\n      {...rest}\n    />\n  );\n};\n\nconst TableHead: Component<JSX.ThHTMLAttributes<HTMLTableCellElement>> = (props) => {\n  const [local, rest] = splitProps(props, [\"class\"]);\n  return (\n    <th\n      class={cn(\n        \"h-12 px-4 text-left align-middle font-medium text-muted-foreground\",\n        \"[&:has([role=checkbox])]:pr-0\",\n        local.class,\n      )}\n      {...rest}\n    />\n  );\n};\n\nconst TableCell: Component<JSX.TdHTMLAttributes<HTMLTableCellElement>> = (props) => {\n  const [local, rest] = splitProps(props, [\"class\"]);\n  return <td class={cn(\"p-4 align-middle [&:has([role=checkbox])]:pr-0\", local.class)} {...rest} />;\n};\n\nconst TableCaption: Component<JSX.HTMLAttributes<HTMLTableCaptionElement>> = (props) => {\n  const [local, rest] = splitProps(props, [\"class\"]);\n  return (\n    <caption\n      class={cn(\"mt-4 text-sm text-muted-foreground\", local.class)}\n      {...(rest as JSX.HTMLAttributes<HTMLTableCaptionElement>)}\n    />\n  );\n};\n\nexport { Table, TableHeader, TableBody, TableFooter, TableRow, TableHead, TableCell, TableCaption };\n"
    }
  ]
}
