{
  "$schema": "https://solidcn.dev/schema/registry-item.json",
  "name": "card",
  "type": "registry:ui",
  "title": "Card",
  "description": "card component for SolidJS",
  "dependencies": [],
  "devDependencies": [],
  "registryDependencies": ["utils"],
  "files": [
    {
      "path": "components/ui/card.tsx",
      "type": "registry:ui",
      "content": "import type { Component, JSX } from \"solid-js\";\nimport { splitProps } from \"solid-js\";\nimport { cn } from \"~/lib/utils\";\n\nconst Card: Component<JSX.HTMLAttributes<HTMLDivElement>> = (props) => {\n  const [local, rest] = splitProps(props, [\"class\"]);\n  return (\n    <div\n      class={cn(\"rounded-lg border bg-card text-card-foreground shadow-sm\", local.class)}\n      {...rest}\n    />\n  );\n};\n\nconst CardHeader: Component<JSX.HTMLAttributes<HTMLDivElement>> = (props) => {\n  const [local, rest] = splitProps(props, [\"class\"]);\n  return <div class={cn(\"flex flex-col space-y-1.5 p-6\", local.class)} {...rest} />;\n};\n\nconst CardTitle: Component<JSX.HTMLAttributes<HTMLHeadingElement>> = (props) => {\n  const [local, rest] = splitProps(props, [\"class\"]);\n  return (\n    <h3 class={cn(\"text-2xl font-semibold leading-none tracking-tight\", local.class)} {...rest} />\n  );\n};\n\nconst CardDescription: Component<JSX.HTMLAttributes<HTMLParagraphElement>> = (props) => {\n  const [local, rest] = splitProps(props, [\"class\"]);\n  return <p class={cn(\"text-sm text-muted-foreground\", local.class)} {...rest} />;\n};\n\nconst CardContent: Component<JSX.HTMLAttributes<HTMLDivElement>> = (props) => {\n  const [local, rest] = splitProps(props, [\"class\"]);\n  return <div class={cn(\"p-6 pt-0\", local.class)} {...rest} />;\n};\n\nconst CardFooter: Component<JSX.HTMLAttributes<HTMLDivElement>> = (props) => {\n  const [local, rest] = splitProps(props, [\"class\"]);\n  return <div class={cn(\"flex items-center p-6 pt-0\", local.class)} {...rest} />;\n};\n\nexport { Card, CardHeader, CardTitle, CardDescription, CardContent, CardFooter };\n"
    }
  ]
}
