{
  "$schema": "https://solidcn.dev/schema/registry-item.json",
  "name": "form",
  "type": "registry:ui",
  "title": "Form",
  "description": "form component for SolidJS",
  "dependencies": [],
  "devDependencies": [],
  "registryDependencies": ["utils"],
  "files": [
    {
      "path": "components/ui/form.tsx",
      "type": "registry:ui",
      "content": "import type { Component, JSX } from \"solid-js\";\nimport { createContext, splitProps, useContext } from \"solid-js\";\nimport { cn } from \"~/lib/utils\";\n\n// ---------------------------------------------------------------------------\n// Form — thin wrappers that compose with @modular-forms/solid\n//\n// Usage (with @modular-forms/solid):\n//   const [form, { Form, Field }] = createForm<LoginForm>();\n//   <Form onSubmit={handleSubmit}>\n//     <Field name=\"email\">\n//       {(field, props) => (\n//         <FormField>\n//           <FormLabel for={field.name}>Email</FormLabel>\n//           <Input {...props} type=\"email\" />\n//           <Show when={field.error}>\n//             <FormMessage>{field.error}</FormMessage>\n//           </Show>\n//         </FormField>\n//       )}\n//     </Field>\n//   </Form>\n// ---------------------------------------------------------------------------\n\nconst FormFieldContext = createContext<{ name?: string }>({});\n\nexport const FormField: Component<JSX.HTMLAttributes<HTMLDivElement> & { name?: string }> = (\n  props,\n) => {\n  const [local, rest] = splitProps(props, [\"class\", \"name\"]);\n  return (\n    <FormFieldContext.Provider value={local.name !== undefined ? { name: local.name } : {}}>\n      <div class={cn(\"space-y-2\", local.class)} {...rest} />\n    </FormFieldContext.Provider>\n  );\n};\n\nexport const useFormField = () => useContext(FormFieldContext);\n\nexport type FormLabelProps = JSX.LabelHTMLAttributes<HTMLLabelElement> & {\n  error?: boolean;\n};\n\nexport const FormLabel: Component<FormLabelProps> = (props) => {\n  const [local, rest] = splitProps(props, [\"class\", \"error\"]);\n  return (\n    <label\n      class={cn(\n        \"text-sm font-medium leading-none peer-disabled:cursor-not-allowed peer-disabled:opacity-70\",\n        local.error && \"text-destructive\",\n        local.class,\n      )}\n      {...rest}\n    />\n  );\n};\n\nexport const FormControl: Component<JSX.HTMLAttributes<HTMLDivElement>> = (props) => {\n  const [local, rest] = splitProps(props, [\"class\"]);\n  return <div class={cn(\"\", local.class)} {...rest} />;\n};\n\nexport const FormDescription: Component<JSX.HTMLAttributes<HTMLParagraphElement>> = (props) => {\n  const [local, rest] = splitProps(props, [\"class\"]);\n  return <p class={cn(\"text-sm text-muted-foreground\", local.class)} {...rest} />;\n};\n\nexport const FormMessage: Component<JSX.HTMLAttributes<HTMLParagraphElement>> = (props) => {\n  const [local, rest] = splitProps(props, [\"class\", \"children\"]);\n  if (!local.children) return null;\n  return (\n    <p class={cn(\"text-sm font-medium text-destructive\", local.class)} {...rest}>\n      {local.children}\n    </p>\n  );\n};\n\n// FormItem is an alias for FormField\nexport const FormItem = FormField;\n"
    }
  ]
}
