{
  "$schema": "https://solidcn.dev/schema/registry-item.json",
  "name": "utils",
  "type": "registry:lib",
  "title": "Utils",
  "description": "Shared utility helpers for solidcn components",
  "dependencies": ["clsx", "tailwind-merge"],
  "devDependencies": [],
  "registryDependencies": [],
  "files": [
    {
      "path": "lib/utils.ts",
      "type": "registry:lib",
      "content": "import { type ClassValue, clsx } from \"clsx\";\nimport { twMerge } from \"tailwind-merge\";\n\nexport function cn(...inputs: ClassValue[]): string {\n  return twMerge(clsx(inputs));\n}\n"
    }
  ]
}
